title,company_type,company_size,skills,additional,views_count,english_level
Програміст 1С,Роздрібна торгівля;,більше 1000 співробітників,", MS Excel, MySQL, Користувач 1С, Програмування, Програмування 1С, Налаштування СКД",Повна зайнятість. Досвід роботи від 1 року.,1,
Програміст 1C,"Будівельна промисловість, деревообробка;",250–1000 співробітників,", 1С УТП, Програмування, Програмування 1С, Налаштування СКД",Повна зайнятість. Досвід роботи від 2 років. Вища освіта.,3,
Програміст-десинатор в'язального обладнання,"Оптова торгівля, дистрибуція, імпорт, експорт;",250–1000 співробітників,", Комунікабельність, Відповідальність, Уважність, Старанність",Повна зайнятість. Досвід роботи від 2 років.,6,
MS SQL Server database developer,IT;,менше 10 співробітників,", SQL, MS SQL Server, Programming, Oracle SQL Developer, Determination, Database design",Повна зайнятість. Досвід роботи від 2 років.,2,
Android-програміст,IT;,10–50 співробітників,", Git, XML, JSON, Android SDK, Знання принципів ООП, Знання принципів MVC, REST API, REST, Kotlin, MVVM, Розуміння архітектури MVP, Realm, Саморозвиток, LiveData, SDK, Продуктивність, Бажання вчитися і розвиватися",Повна зайнятість.,2,
WordPress-розробник,IT;,менше 10 співробітників,", CSS, HTML, PHP, MySQL, WordPress, JavaScript, Ответственность, Content Management System, Верстка, Адаптивная верстка, Elementor, ACF, Самостоятельность, Желание учиться и развиваться, Разработка сайтов на Shopify","Неповна зайнятість. Також готові взяти студента, людину з інвалідністю. Досвід роботи від 1 року.",3,Російська — середній
Программист (PHP Middle),IT;,менше 10 співробітників,", PHP, MySQL, Git, Администрирование Apache, PHPUnit, nginx, Codeception",Повна зайнятість. Досвід роботи від 2 років.,3,"Російська — вільно, англійська — просунутий"
"Програміст 1С, BAS","Будівельна промисловість, деревообробка;",50–250 співробітників,", Користувач 1С, Ведення бухгалтерського обліку, Комунікабельність, Користувач ERP-системи, Користувач BAS, Програмування, Робота з базою даних, Уважність, Програмування 1С, Налаштування СКД","Повна зайнятість, неповна зайнятість. Досвід роботи від 2 років. Вища освіта.",1,
Інженер-програміст дронів,"Пошук персоналу, HR;",10–50 співробітників,", Програмування","Повна зайнятість. Також готові взяти студента, людину з інвалідністю, ветерана, пенсіонера. Досвід роботи від 1 року.",1,
Game developer,IT;,менше 10 співробітників,", Програмування, C++, Reading blueprints, Unreal Engine","Неповна зайнятість. Також готові взяти студента, людину з інвалідністю, ветерана, пенсіонера. Досвід роботи від 1 року.",1,
Java бекенд-розробник в стартап,IT;,менше 10 співробітників,", Java, SQL, Знання принципів ООП, REST, Програмування","Повна зайнятість, неповна зайнятість. Також готові взяти студента, людину з інвалідністю, ветерана, пенсіонера.",4,
"Team Lead, PHP-програміст","Маркетинг, реклама, PR;",менше 10 співробітників,", CSS, Користувач ОС Linux, JavaScript, HTML, PHP, MySQL, React, Відповідальність, Знання принципів ООП, Laravel, Node.js, TypeScript, Робота в команді, Адміністрування Apache, nginx, Здатність до навчання, REST, Програмування, Bitbucket, AWS, WebSocket, Організованість, Blockchain","Повна зайнятість, неповна зайнятість. Досвід роботи від 2 років.",2,Англійська — вище середнього
Програміст 1C (BAF),Роздрібна торгівля;,250–1000 співробітників,", Користувач ОС Windows, Користувач 1С, Пунктуальність, Програмування, Програмування 1С, Бажання вчитися і розвиватися",Повна зайнятість. Досвід роботи від 1 року.,1,
"Machine Learning, Python Developer",IT;,50–250 співробітників,", Python, Responsibility, Machine learning, Deep Learning","Повна зайнятість. Також готові взяти студента, людину з інвалідністю, ветерана. Вища освіта.",2,Англійська — середній
Програміст 1C (BAF),Роздрібна торгівля;,250–1000 співробітників,", Користувач ОС Windows, Користувач 1С, Пунктуальність, Програмування, Програмування 1С, Бажання вчитися і розвиватися",Повна зайнятість. Досвід роботи від 1 року.,1,
Програміст Odoo,"Хімічна промисловість, фармацевтика;",більше 1000 співробітників,,Повна зайнятість. Досвід роботи від 2 років. Вища освіта.,2,
SQL/Node.js Developer,IT;,10–50 співробітників,", SQL, JavaScript, PostgreSQL, XML, Oracle Database, PL/SQL, Node.js",Повна зайнятість. Також готові взяти пенсіонера. Досвід роботи від 2 років. Вища освіта.,1,
"Back end розробник (С#, розробка GTA RP серверу)",IT;,менше 10 співробітників,", MySQL, Git, C#, Знання принципів ООП, Стресостійкість, Здатність до навчання, REST API, REST, Цілеспрямованість, SOLID Principles","Повна зайнятість. Також готові взяти студента, людину з інвалідністю, ветерана. Досвід роботи від 1 року.",3,
"SQL, SSIS, SSRS, ETL developer",IT;,менше 10 співробітників,,Повна зайнятість. Досвід роботи від 2 років.,1,
Senior Backend Developer (PHP),IT;,10–50 співробітників,", CSS, Користувач ОС Linux, JavaScript, HTML, PHP, MySQL, Git, Jira, Відповідальність, Знання принципів ООП, Laravel, Docker, Vue.js, Composer",Повна зайнятість. Також готові взяти людину з інвалідністю. Досвід роботи від 5 років.,1,
C++ embedded developer (Linux),"Телекомунікації, зв'язок",,", Користувач ОС Linux, Git, Python, C++, Програмування, OpenCV",Повна зайнятість. Досвід роботи від 2 років. Вища освіта.,2,
PHP full-stack developer,"Медицина, охорона здоров'я, аптеки;",10–50 співробітників,", CSS, JavaScript, PHP, SQL, Git, Knowledge of OOP principles, Front-end development","Повна зайнятість, неповна зайнятість. Також готові взяти людину з інвалідністю, ветерана, пенсіонера. Досвід роботи від 2 років. Вища освіта.",3,
UI-розробник,IT;,50–250 співробітників,", CSS, JavaScript, HTML, Адаптивність",Повна зайнятість. Досвід роботи від 2 років.,1,
Программист PHP (Middle),"Транспорт, логістика;",10–50 співробітників,", CSS, HTML, PHP, MySQL, Git, Bootstrap, JavaScript, AJAX, jQuery, Знання принципів ООП, Знання принципів MVC, Yii, Redis, Програмування, WebSocket, Доброзичливість",Повна зайнятість. Досвід роботи від 2 років.,1,
Програміст BAS,"Неприбуткові, благодійні та громадські організації;",10–50 співробітників,,Повна зайнятість. Досвід роботи від 1 року.,1,
Програміст 1C,Легка промисловість;,250–1000 співробітників,", Користувач 1С, Конвертація даних, 1С УТП",Повна зайнятість. Досвід роботи від 1 року.,1,
"C++, C# Developer (Windows)",IT;,50–250 співробітників,", Windows OS User, Git, C++, C#, SOLID Principles, Knowledge of OOP principles, GUI, MS Access",Повна зайнятість. Досвід роботи від 1 року.,1,
Програміст 1C,"Транспорт, логістика;",250–1000 співробітників,", Користувач 1С, Програмування, Програмування 1С, Проактивність, Компетентність",Повна зайнятість. Досвід роботи від 2 років. Вища освіта.,1,
"Програміст 1C, BAS","Хімічна промисловість, фармацевтика;",50–250 співробітників,", SQL, Користувач 1С, Комунікабельність, MS SQL Server, Користувач ERP-системи, Користувач BAS, Робота з базою даних",Повна зайнятість. Досвід роботи від 1 року. Вища освіта.,1,
Senior PHP Developer,"Маркетинг, реклама, PR;",50–250 співробітників,", CSS, Користувач ОС Linux, JavaScript, HTML, PHP, MySQL, Git, PostgreSQL, SEO, MongoDB, Docker, Docker Compose, Адміністрування Apache, PHPUnit, nginx, Redis, Цілеспрямованість, Symfony, RabbitMQ, Codeception",Повна зайнятість. Досвід роботи від 5 років.,1,Англійська — середній
Senior Mobile Software Developer,IT;,10–50 співробітників,", Відповідальність, Kotlin, Ініціативність",Повна зайнятість. Досвід роботи від 5 років.,1,
React Native Developer,"Краса, фітнес, спорт;",50–250 співробітників,,Повна зайнятість. Досвід роботи від 2 років. Вища освіта.,1,
Програміст BAF (1C),Роздрібна торгівля;,250–1000 співробітників,", Користувач 1С, Користувач BAS, Програмування, Уважність, Чесність, Активна життєва позиція, Налаштування СКД",Повна зайнятість. Досвід роботи від 2 років. Вища освіта.,1,
Програміст BAS,"Будівельна промисловість, деревообробка",,", Висока працездатність",Повна зайнятість. Досвід роботи від 2 років. Вища освіта.,1,
Інженер-розробник високочастотних радіоелектронних пристроїв,Машинобудування;,10–50 співробітників,,Повна зайнятість. Також готові взяти людину з інвалідністю. Досвід роботи від 2 років. Вища освіта.,1,
Full-stack PHP-розробник,"Сільське господарство, агробізнес;",більше 1000 співробітників,", JavaScript, PHP, MySQL",Повна зайнятість. Досвід роботи від 1 року. Вища освіта.,1,
"Программист 1С, BAF","Консалтинг, бухгалтерія, аудит;",менше 10 співробітників,", Користувач 1С, Користувач BAS, Програмування, Програмування 1С","Повна зайнятість, неповна зайнятість. Також готові взяти студента, людину з інвалідністю. Досвід роботи від 1 року.",1,
Intern Front-end developer (Angular),IT;,50–250 співробітників,", CSS, JavaScript, HTML, Git, SASS, Google Sheets, TypeScript, REST API, Angular, CSS Grid Layout, FLEX, RxJS",Повна зайнятість. Також готові взяти студента. Незакінчена вища освіта.,2,Англійська — просунутий
Embedded-розробник,IT;,50–250 співробітників,", Git, C++, Робота в команді, Програмування, Програмування мікроконтролерів, Розробка друкованих плат, Продуктивність, Знання архітектури ARM, C/C++","Повна зайнятість, неповна зайнятість. Досвід роботи від 2 років. Вища освіта.",1,
Intern Python developer,IT;,50–250 співробітників,", Git, Python, Комунікабельність, Програмування, Знання принципів ООП, PyQt, Tkinter",Повна зайнятість. Також готові взяти студента. Незакінчена вища освіта.,2,Англійська — просунутий
Back-end розробник,Роздрібна торгівля;,50–250 співробітників,", CSS, Користувач ОС Linux, JavaScript, HTML, PHP, MySQL, SQL, Git, PostgreSQL, React, JSON, Відповідальність, Знання принципів ООП, Laravel, Docker, Робота в команді, PHPUnit, REST API, REST, Angular, Redis, SOLID Principles, Mailchimp, Робота з базою даних, Грамотна усна та письмова мова, Аналітичне мислення, eSputnik, Йога, Позитивне мислення",Повна зайнятість. Досвід роботи від 2 років. Вища освіта.,1,
BI-розробник фінансового департаменту,"Фінанси, банки, страхування",,", MS Office, MS Excel, SQL, MS Power BI, Tableau, ПЗ «Scrooge 3»",Повна зайнятість. Досвід роботи від 1 року. Вища освіта.,1,
C# Developer,Роздрібна торгівля;,менше 10 співробітників,", JavaScript, C#","Повна зайнятість, неповна зайнятість. Досвід роботи від 1 року.",1,
Node.js developer,"Маркетинг, реклама, PR;",10–50 співробітників,", Відповідальність",Повна зайнятість. Досвід роботи від 1 року. Вища освіта.,1,
Junior Python Developer,"Маркетинг, реклама, PR;",10–50 співробітників,", Користувач ОС Linux, SQL, Git, GitHub, Python, Комунікабельність, Telegram API, Django, Flask",Повна зайнятість. Досвід роботи від 1 року.,4,Англійська — середній
Full stack developer,IT;,10–50 співробітників,", CSS, Користувач ОС Linux, HTML, PHP, MySQL, Git, JavaScript, Scrum, Знання принципів ООП, MongoDB, Angular, Frontend-розробка, Надійність, Продуктивність, Бажання вчитися і розвиватися",Повна зайнятість. Досвід роботи від 1 року.,1,
Flutter developer,IT;,10–50 співробітників,", Доброзичливість","Повна зайнятість, неповна зайнятість. Досвід роботи від 2 років.",1,
Програміст 1C,Машинобудування;,50–250 співробітників,", Користувач 1С, Ведення бухгалтерського обліку, Користувач BAS, Конвертація даних, Налаштування СКД","Повна зайнятість. Також готові взяти людину з інвалідністю, ветерана. Досвід роботи від 2 років. Вища освіта.",1,
Full-stack Middle Developer,"Консалтинг, бухгалтерія, аудит;",250–1000 співробітників,,Повна зайнятість. Досвід роботи від 2 років.,1,
Jira Developer,IT;,250–1000 співробітників,,Повна зайнятість. Досвід роботи від 1 року.,1,
"Applied mathematician, programmer C++",IT;,менше 10 співробітників,", Linux OS user, Git, GitHub, Jira, Python, BASH, Programming, C++, Linux, PyTorch, Machine learning, Autogen, Kubernetes, Math, Copilot","Повна зайнятість. Також готові взяти студента, людину з інвалідністю, ветерана, пенсіонера. Досвід роботи від 2 років. Вища освіта.",2,Англійська — вище середнього
Програміст 1C,Харчова промисловість;,більше 1000 співробітників,", Користувач 1С, Комунікабельність, Відповідальність, Програмування, Уважність, Програмування 1С",Повна зайнятість. Досвід роботи від 2 років. Вища освіта.,1,
"Програміст BAS, 1C","Пошук персоналу, HR;",10–50 співробітників,", 1С:Підприємство, Відповідальність, Користувач ERP-системи, Користувач BAS, Програмування, Конвертація даних, Бажання вчитися і розвиватися",Повна зайнятість. Досвід роботи від 2 років. Вища освіта.,1,
"Адміністратор БД, розробник 1С","Хімічна промисловість, фармацевтика;",250–1000 співробітників,", MS Word, MS Excel, MS Office, Користувач 1С, Ведення бухгалтерського обліку, Відповідальність, Користувач ERP-системи, Користувач BAS, Робота з базою даних",Повна зайнятість. Досвід роботи від 2 років.,1,
Middle Oracle Apex Developer,IT;,50–250 співробітників,", SQL, Oracle Database, Oracle SQL Developer, PL/SQL, Ініціативність",Повна зайнятість. Досвід роботи від 2 років.,1,Англійська — середній
Full-stack програміст на Python (Strong Junior),"Медицина, охорона здоров'я, аптеки;",більше 1000 співробітників,", JavaScript, SQL, Python, Комунікабельність, Відповідальність, jQuery, Django, Django Rest Framework, Робота в команді, MS SQL Server, Frontend-розробка",Повна зайнятість. Досвід роботи від 2 років. Вища освіта.,1,
"Lead/Senior SQL, JS Developer",IT;,менше 10 співробітників,", SQL, JavaScript, React, Відповідальність, Уважність, Oracle SQL Developer",Повна зайнятість. Досвід роботи від 5 років.,1,Англійська — вище середнього
Python Backend Developer,IT;,50–250 співробітників,", Користувач ОС Linux, SQL, Git, Python, Docker, NoSQL, Backend-розробка, Робота в команді",Повна зайнятість. Досвід роботи від 1 року. Вища освіта.,1,Англійська — середній
"Розробник PL/SQL, APEX",IT;,50–250 співробітників,", Java, SQL, Oracle Database, Oracle SQL Developer, PL/SQL, Продуктивність",Повна зайнятість. Досвід роботи від 5 років.,1,
Програміст 1C,"Оптова торгівля, дистрибуція, імпорт, експорт;",250–1000 співробітників,", Користувач 1С, 1С:Підприємство, Користувач BAS, Програмування, Робота з базою даних, Чесність, Програмування 1С, Висока працездатність, Професіоналізм, Конвертація даних, Продуктивність, Налаштування СКД",Повна зайнятість. Досвід роботи від 5 років.,1,
PHP developer,IT;,250–1000 співробітників,", PHP, MySQL, Git, PostgreSQL, Content Management System, Laravel, REST API, REST, Redis, RabbitMQ, Phalcon, Apache Kafka, Розробка API",Повна зайнятість. Також готові взяти студента. Досвід роботи від 1 року. Вища освіта.,1,
Middle Python Back end Developer,IT;,10–50 співробітників,", Git, JavaScript, Python, PostgreSQL, Django, Django Rest Framework, nginx, HTTP, REST, Angular, Redis, Elasticsearch, Celery, WebSocket",Повна зайнятість. Досвід роботи від 2 років. Вища освіта.,2,
Розробник Front-end (React),IT;,10–50 співробітників,,"Повна зайнятість. Також готові взяти людину з інвалідністю, ветерана. Досвід роботи від 2 років. Незакінчена вища освіта.",1,Англійська — середній
Full stack software engineer,"Фінанси, банки, страхування;",250–1000 співробітників,,Повна зайнятість. Досвід роботи від 2 років. Вища освіта.,1,Англійська — вище середнього
Інженер-програміст відділу підтримки користувачів та операцій,"Фінанси, банки, страхування;",250–1000 співробітників,", SQL, MS SQL Server, Адміністративна робота, Адміністрування СУБД",Повна зайнятість. Досвід роботи від 2 років. Вища освіта.,1,Англійська — середній
Junior PHP developer,IT;,10–50 співробітників,", CSS, JavaScript, HTML, PHP, MySQL, Git, jQuery, Знання принципів ООП, Знання принципів MVC, Bitbucket, CodeIgniter, Продуктивність, Бажання вчитися і розвиватися",Повна зайнятість. Також готові взяти студента. Досвід роботи від 1 року.,1,
Middle Wordpress developer,IT;,більше 1000 співробітників,", PHP, MySQL, WordPress, JavaScript, HTML, CSS, Знання принципів ООП, Content Management System, Верстка",Повна зайнятість. Досвід роботи від 2 років.,1,
"Конструктор-електронік, програміст у Бровари",Машинобудування;,10–50 співробітників,", Відповідальність, Програмування, Знання САПР, Ініціативність, Знання ЄСКД, Саморозвиток, БАЗИС",Повна зайнятість. Досвід роботи від 1 року. Вища освіта.,1,
Інженер-програміст АСУ ТП,IT;,50–250 співробітників,", Водійські права кат. B, Програмування, Уважність, TIA Portal, Simatic Step 7, Сумлінність",Повна зайнятість. Досвід роботи від 2 років. Вища освіта.,1,
