title,company_type,company_size,skills,additional,views_count,english_level
Головний спеціаліст відділу адміністрування інформаційних систем,Державні організації;,більше 1000 співробітників,", Стресостійкість, Адаптивність",Повна зайнятість. Вища освіта.,1,Українська — вільно
Radiologist (Medical student for CT Data labeling),"Медицина, охорона здоров'я, аптеки;",менше 10 співробітників,", CT scan, radiology, Application of artificial intelligence","Повна зайнятість, неповна зайнятість. Також готові взяти студента, людину з інвалідністю, ветерана, пенсіонера. Досвід роботи від 1 року. Вища освіта.",1,Англійська — середній
"Спеціаліст інформаційного відділу, офіс-менеджер","Охорона, безпека;",10–50 співробітників,", Знання офісних програм, Відповідальність, Організованість, Робота з клієнтами, Робота з базою даних, Продаж, Урегулювання конфліктів, Робота в команді, Прийом та обробка замовлень, Надійність, Здійснення вихідних дзвінків, Прийом вхідних дзвінків, Бажання вчитися і розвиватися",Повна зайнятість. Досвід роботи від 1 року.,1,
Головний спеціаліст відділу використання інформації документів,Державні організації;,10–50 співробітників,,"Повна зайнятість. Також готові взяти студента, людину з інвалідністю, ветерана. Незакінчена вища освіта.",1,
"Фахівець з обробки інформації, дата-менеджер","Неприбуткові, благодійні та громадські організації;",50–250 співробітників,,Повна зайнятість. Вища освіта.,1,Англійська — початковий
"Фахівець з обробки інформації, дата-менеджер","Неприбуткові, благодійні та громадські організації;",50–250 співробітників,,Повна зайнятість. Вища освіта.,1,Англійська — початковий
Junior Analyst,IT;,10–50 співробітників,", MS Office, Комунікабельність, Відповідальність, Робота з великим обсягом інформації",Повна зайнятість. Також готові взяти студента. Незакінчена вища освіта.,1,
Data Scientist (middle +),"Фінанси, банки, страхування;",50–250 співробітників,", SQL, Python, Відповідальність, Програмування, Робота з базою даних, Уміння аналізувати, pandas, TensorFlow, Machine learning, PyTorch",Повна зайнятість. Досвід роботи від 2 років. Вища освіта.,1,Англійська — середній
Data Analyst (middle+),"Фінанси, банки, страхування;",50–250 співробітників,", SQL, Git, Looker Studio, Організованість, Активність, Маркетинг, Робота з базою даних, Адміністрування СУБД, Ведення звітності, Управління командою",Повна зайнятість. Досвід роботи від 2 років. Вища освіта.,1,Англійська — середній
Junior data analyst,"Фінанси, банки, страхування;",50–250 співробітників,", SQL, Git, Looker Studio, Робота з базою даних, Адміністрування СУБД, Бізнес-аналіз",Повна зайнятість. Досвід роботи від 1 року. Вища освіта.,1,Англійська — середній
Головний спеціаліст відділу захисту інформаційних систем,Державні організації;,250–1000 співробітників,", Відповідальність, Комунікабельність, Налаштування ПК, Налаштування мережевого обладнання, Висока працездатність",Повна зайнятість. Вища освіта.,1,Українська — вільно
Головний спеціаліст відділу адміністрування інформаційних систем,Державні організації;,250–1000 співробітників,", Відповідальність, Комунікабельність, Налаштування ПК, Налаштування мережевого обладнання, Висока працездатність, Адміністрування локальної мережі, Системне адміністрування",Повна зайнятість. Вища освіта.,1,Українська — вільно
Оператор обробки інформації та програмного забезпечення,IT;,50–250 співробітників,,Повна зайнятість. Також готові взяти людину з інвалідністю. Вища освіта.,1,
Технік групи інформаційного та сценічного забезпечення,"Шоу-бізнес, мистецтво, культура;",50–250 співробітників,", Користувач ОС Windows, Ведення документації, Ремонт ПК",Повна зайнятість. Досвід роботи від 1 року. Вища освіта.,1,
Data Analyst (Marketing),IT;,менше 10 співробітників,", MS Excel, SQL, Python, Looker Studio, Відповідальність, MS Power BI, Маркетинг, Робота з базою даних, Уважність, Аналітичне мислення, Уміння аналізувати, Аналіз даних, Продаж, Ведення звітності, pandas, NumPy, Matplotlib, Доброзичливість","Повна зайнятість, неповна зайнятість. Досвід роботи від 1 року. Вища освіта.",1,
"Головний спеціаліст, системотехнік відділу адміністрування інформаційних систем",Державні організації,,", Управління персоналом, Організованість, Робота в команді, Системне адміністрування, Адміністрування локальної мережі, Адміністрування серверів, Робота з базою даних, Уважність, Грамотна усна та письмова мова, Цифрова грамотність, Висока працездатність, Налаштування прикладного ПЗ, LAN, Компетентність, Самомотивація, Самостійність, Надійність, Водійські права кат. B",Повна зайнятість. Вища освіта.,1,Українська — вільно
Data analyst,"Неприбуткові, благодійні та громадські організації;",50–250 співробітників,", MS Excel, SQL, Знання офісних програм, PostgreSQL, Scrum, Agile, Oracle Database, Looker Studio, Керування транспортними засобами, Здатність до навчання, Kanban, MS Power BI, Робота з базою даних, Створення презентацій, Аналіз даних, QlikView, Tableau, Бажання вчитися і розвиватися",Повна зайнятість. Досвід роботи від 2 років. Вища освіта.,1,
Фахівець з інформаційного забезпечення,"Медицина, охорона здоров'я, аптеки;",250–1000 співробітників,,"Повна зайнятість. Також готові взяти студента, людину з інвалідністю, ветерана. Досвід роботи від 1 року. Вища освіта.",1,
Фахівець управління систем захисту інформації,"Пошук персоналу, HR;",10–50 співробітників,", Користувач ОС Linux, Користувач ОС Windows, IP (Internet Protocol), TCP/IP, Системне адміністрування, Налаштування антивірусного захисту",Повна зайнятість. Досвід роботи від 2 років. Вища освіта.,1,
Викладач на кафедру інформаційних систем та технологій,"Пошук персоналу, HR;",250–1000 співробітників,,Повна зайнятість. Досвід роботи від 5 років. Вища освіта.,1,"Українська — просунутий, англійська — вище середнього"
Data analyst,"Сільське господарство, агробізнес;",10–50 співробітників,", MS Excel, MS Power BI, Аналіз даних, Тайм-менеджмент, Акуратність, Робота в команді, Адаптивність, Надійність, Візуалізація даних, Уміння розставляти пріоритети","Повна зайнятість. Також готові взяти людину з інвалідністю, ветерана. Досвід роботи від 2 років. Вища освіта.",1,Англійська — вище середнього
"Інженер-програміст MS SQL, C#, .Net","Маркетинг, реклама, PR;",250–1000 співробітників,", SQL, C#, MS SQL Server, Програмування, Уважність, Самоосвіта",Повна зайнятість. Досвід роботи від 5 років. Вища освіта.,1,
"Системний аналітик, контент-менеджер (Excel)",IT;,10–50 співробітників,", MS Excel, Знання принципів ООП, VBA, Програмування, Аналітичне мислення, Контент-менеджмент, Ведення звітності",Повна зайнятість. Також готові взяти людину з інвалідністю. Досвід роботи від 2 років. Вища освіта.,1,Англійська — середній
Експерт у відділ моніторингу та менеджменту інформації з безпеки,"Медицина, охорона здоров'я, аптеки;",250–1000 співробітників,,Повна зайнятість. Досвід роботи від 1 року. Вища освіта.,1,
Product Information Manager,Легка промисловість;,10–50 співробітників,", MS Office, MS Excel, Користувач ОС Windows, Комунікабельність, Відповідальність, Організованість, Маркетинг, Уважність, Управління проєктами, Ведення звітності, Продакт-менеджмент","Повна зайнятість, неповна зайнятість. Також готові взяти студента, ветерана. Досвід роботи від 2 років.",1,Англійська — вище середнього
Product Matching Analyst (Manual Data Entry),IT;,50–250 співробітників,", SQL, Відповідальність, Ведення звітності, Ініціативність","Повна зайнятість. Також готові взяти студента, ветерана. Середня освіта.",1,
"Data Journalist, Analyst",IT;,10–50 співробітників,", Figma, SQL, Python, Маркетинг, Програмування, Дизайн, Аналітичне мислення, Аналіз даних, Акуратність, Ініціативність, Проактивність, Machine learning, Самостійність","Повна зайнятість, неповна зайнятість. Також готові взяти ветерана. Досвід роботи від 1 року. Вища освіта.",1,Англійська — просунутий
Data Engineer,IT;,10–50 співробітників,", Самостійність",Повна зайнятість. Також готові взяти ветерана. Досвід роботи від 2 років. Вища освіта.,1,Англійська — просунутий
Менеджер напрямку інформаційних продуктів,Юриспруденція;,10–50 співробітників,", Маркетинг, Продаж, Ведення звітності, дірект маркетинг",Повна зайнятість. Досвід роботи від 1 року. Вища освіта.,1,
"Головний фахівець інформаційного відділу, інформаційної безпеки","Пошук персоналу, HR;",10–50 співробітників,,Повна зайнятість. Досвід роботи від 1 року. Вища освіта.,1,
"Менеджер, фахівець з інформаційної безпеки",IT;,50–250 співробітників,", Комунікабельність, IP (Internet Protocol), VMware, Аналітичне мислення, Налаштування антивірусного захисту, SIEM, Знання стандартів ISO",Повна зайнятість. Досвід роботи від 2 років. Вища освіта.,1,
Фахівець управління систем захисту інформації,"Пошук персоналу, HR;",10–50 співробітників,", Користувач ОС Linux, Користувач ОС Windows, IP (Internet Protocol), TCP/IP, Системне адміністрування, Налаштування антивірусного захисту",Повна зайнятість. Досвід роботи від 2 років. Вища освіта.,1,
Фахівець інформаційних технологій (1 кат.) відділу інформаційного забезпечення,Послуги для населення та бізнесу;,250–1000 співробітників,", Користувач ОС Windows, DHCP, Комунікабельність, Стресостійкість, Активність, Пунктуальність, MikroTik, Адміністрування Windows Server, Уважність, Налаштування ОС, Налаштування мережевого обладнання, Ведення документації, Грамотна усна та письмова мова, Технічна підтримка користувачів, Активна життєва позиція, Налаштування DNS, Адміністрування ОС Windows, Бажання вчитися і розвиватися",Повна зайнятість. Також готові взяти людину з інвалідністю. Досвід роботи від 1 року. Вища освіта.,1,
Адміністратор доступу до інформаційних систем,"Фінанси, банки, страхування;",250–1000 співробітників,", Відповідальність, Програмування, Уважність, Технічна підтримка користувачів, Написання скриптів",Повна зайнятість. Вища освіта.,1,
Senior Data Engineer,IT;,10–50 співробітників,", Продуктивність",Повна зайнятість. Досвід роботи від 2 років. Вища освіта.,1,Англійська — просунутий
Data Entry Operator,"Оптова торгівля, дистрибуція, імпорт, експорт;",10–50 співробітників,", MS Excel, Google Sheets, Работа с базой данных",Повна зайнятість. Досвід роботи від 2 років. Вища освіта.,1,"Англійська — початковий, німецька — початковий"
Спеціаліст з впровадження інформаційних систем,IT;,50–250 співробітників,,Повна зайнятість. Досвід роботи від 1 року.,1,
Senior Data Scientist,IT;,більше 1000 співробітників,", SQL, GitHub, Python, PostgreSQL, MongoDB, Docker, Робота з базою даних, AWS, Візуалізація, pandas, NumPy, MS Azure, TensorFlow, PyTorch, Ініціативність",Повна зайнятість. Досвід роботи від 5 років. Вища освіта.,1,Англійська — вище середнього
"Фахівець з профорієнтації (створення реклами, розповсюдження інформації у закладах освіти)","Освіта, наука;",10–50 співробітників,", Наявність організаційних навичок, Вміння працювати в команді",Повна зайнятість. Також готові взяти студента. Незакінчена вища освіта.,1,
Business Data Analyst,Роздрібна торгівля;,10–50 співробітників,", SQL, Looker Studio, Communicability, Responsibility, Work with the database, Sales analysis, Sales, Data analysis, Accuracy, Reporting, Hardworking, Data visualization, Visualization, Helium 10",Повна зайнятість. Досвід роботи від 2 років.,1,Англійська — просунутий
"Data manager, Traffic manager","Маркетинг, реклама, PR;",50–250 співробітників,", MS Excel, Ведення CRM, Користувач ПК, SEO, Відповідальність, Уважність",Повна зайнятість.,1,
"Data analyst, Excel Master",IT;,10–50 співробітників,", MS Excel, Відповідальність, Формування зведених таблиць, Робота з базою даних, Уважність, Акуратність, Ведення звітності, Створення макросів",Повна зайнятість. Також готові взяти студента.,1,Англійська — вище середнього
Data base engineer,"Оптова торгівля, дистрибуція, імпорт, експорт;",50–250 співробітників,,Повна зайнятість. Досвід роботи від 2 років. Вища освіта.,1,
"Junior Data Engineer, Analyst",IT;,10–50 співробітників,", Python, Аналіз даних",Повна зайнятість. Також готові взяти студента.,1,
Головний спеціаліст відділу захисту інформаційних систем,Державні організації;,більше 1000 співробітників,", Стресостійкість, Адаптивність",Повна зайнятість. Вища освіта.,1,Українська — вільно
Головний спеціаліст відділу адміністрування інформаційних систем,Державні організації;,більше 1000 співробітників,", Стресостійкість, Адаптивність",Повна зайнятість. Вища освіта.,1,Українська — вільно
Фахівець з інформаційних технологій,Державні організації;,50–250 співробітників,", Комунікабельність, Адміністрування локальної мережі, Налаштування ПЗ, Відеоспостереження, Неконфліктність",Повна зайнятість. Досвід роботи від 2 років. Вища освіта.,1,
Data Entry Operator,IT;,менше 10 співробітників,", MS Excel, Користувач ПК, Відповідальність, Швидкий набір тексту, Робота з базою даних, Уважність, Акуратність",Повна зайнятість. Досвід роботи від 1 року. Середня освіта.,1,Англійська — вище середнього
Менеджер з продажів (Бортничі),IT;,50–250 співробітників,", Впевненість, Активність, Продаж, Пошук нових клієнтів",Повна зайнятість. Досвід роботи від 1 року.,1,
Головний спеціаліст-програміст відділу адміністрування інформаційних систем,Державні організації;,250–1000 співробітників,", C++",Повна зайнятість. Також готові взяти людину з інвалідністю. Вища освіта.,1,
"Фахівець, фахівчиня з обробки інформації групи нетехнічного обстеження","Неприбуткові, благодійні та громадські організації;",250–1000 співробітників,", Цілеспрямованість, Уважність",Повна зайнятість. Досвід роботи від 1 року. Середня спеціальна освіта.,1,
"Фахівець, фахівчиня з обробки інформації групи нетехнічного обстеження","Неприбуткові, благодійні та громадські організації;",250–1000 співробітників,", Цілеспрямованість, Уважність",Повна зайнятість. Досвід роботи від 1 року. Середня спеціальна освіта.,1,
