title,company_type,company_size,skills,additional,views_count,english_level
PLC programmer,IT;,10–50 співробітників,,"Повна зайнятість, неповна зайнятість. Досвід роботи від 1 року.",1,
"Junior Front-End Developer, Volunteer",IT;,менше 10 співробітників,", Git, React, Vue.js",Неповна зайнятість.,3,
Програміст 1C,"Будівельна промисловість, деревообробка",,", Користувач 1С, XML, Користувач ERP-системи, Користувач BAS, Програмування, Висока працездатність, Програмування BAS, Налаштування СКД",Повна зайнятість. Досвід роботи від 2 років. Незакінчена вища освіта.,1,
Програміст BAS,Роздрібна торгівля;,250–1000 співробітників,", Комунікабельність",Повна зайнятість. Досвід роботи від 2 років. Вища освіта.,1,
Junior Android developer,"Маркетинг, реклама, PR;",50–250 співробітників,", Java, Android SDK, Знання принципів ООП, REST API, REST, Firebase, Kotlin, SDK, Розробка додатків на Android, Бажання вчитися і розвиватися",Повна зайнятість. Також готові взяти студента. Досвід роботи від 1 року.,1,
Front-end розробник,IT;,50–250 співробітників,", Комунікабельність, Дизайн, Уважність, Креативність, Frontend-розробка, Бажання вчитися і розвиватися",Повна зайнятість. Також готові взяти студента.,2,
Software developer,IT;,250–1000 співробітників,,Повна зайнятість. Досвід роботи від 2 років.,1,
Системний програміст,IT;,250–1000 співробітників,", Користувач ОС Linux, Користувач ОС Windows, C++",Повна зайнятість. Досвід роботи від 2 років. Вища освіта.,1,Англійська — початковий
Інженер-програміст,IT;,250–1000 співробітників,", Користувач ОС Linux, AutoCAD, SQL, Користувач ОС Windows, C++, MS Visual Studio, Програмування, Qt, Знання САПР, Lua",Повна зайнятість. Досвід роботи від 2 років. Вища освіта.,1,
"Інженер електроніки, програміст мікроконтролерів",IT;,250–1000 співробітників,", Користувач ОС Windows, C++, Програмування, Знання архітектури ARM",Повна зайнятість. Досвід роботи від 2 років. Вища освіта.,1,
Програміст С++,IT;,250–1000 співробітників,", Користувач ОС Linux, Git, C++, Qt",Повна зайнятість. Досвід роботи від 1 року. Вища освіта.,2,
Електронік-програміст,IT;,250–1000 співробітників,", CorelDRAW, C++, C#, SolidWorks, Програмування, Знання САПР, Altium Designer, Програмування мікроконтролерів, Keil uVision",Повна зайнятість. Також готові взяти людину з інвалідністю. Досвід роботи від 1 року.,1,
"Junior full stack developer (Laravel, RabbitMQ, Vue, External API)",IT;,менше 10 співробітників,", Content Management System, Laravel, Vue.js, RabbitMQ, Redux-Thunk",Повна зайнятість. Також готові взяти студента. Досвід роботи від 1 року.,1,
Unity Developer,IT;,10–50 співробітників,", Git, C#, Знание принципов ООП, Unity, VFX, Zenject",Повна зайнятість. Досвід роботи від 2 років.,2,
Технолог-програміст лазерного верстата з ЧПК,Машинобудування;,50–250 співробітників,", Відповідальність, Цілеспрямованість, Уважність, Робота на верстатах ЧПК, Бажання вчитися і розвиватися, Технічна грамотність",Повна зайнятість. Також готові взяти студента.,2,
Програміст 1C,"Медицина, охорона здоров'я, аптеки;",більше 1000 співробітників,", Користувач 1С, 1С:Підприємство, Користувач BAS, Програмування, Програмування 1С, Налаштування СКД",Повна зайнятість. Досвід роботи від 2 років. Вища освіта.,2,
Програміст 1C,"Сільське господарство, агробізнес;",більше 1000 співробітників,", Користувач 1С, 1С:Підприємство, JSON, Комунікабельність, 1С УВП, Програмування, Робота з базою даних, Програмування 1С",Повна зайнятість. Досвід роботи від 1 року.,1,
Програміст (BAS ERP),"Оптова торгівля, дистрибуція, імпорт, експорт;",більше 1000 співробітників,", Висока працездатність, Продуктивність",Повна зайнятість. Досвід роботи від 1 року. Вища освіта.,1,
Технік-програміст,"Лісова промисловість, лісообробка;",250–1000 співробітників,", AutoCAD, КОМПАС, Читання креслень",Повна зайнятість. Досвід роботи від 2 років.,1,
Програміст 1C,"Консалтинг, бухгалтерія, аудит;",менше 10 співробітників,,Повна зайнятість. Досвід роботи від 5 років.,1,
Програміст 1C,"Транспорт, логістика;",10–50 співробітників,", Користувач 1С, Програмування, Програмування 1С",Повна зайнятість. Досвід роботи від 2 років. Середня спеціальна освіта.,1,
Програміст 1С,Роздрібна торгівля;,250–1000 співробітників,", SQL, Користувач 1С, MS SQL Server, Програмування, Робота з базою даних, Програмування 1С, Надійність, Налаштування СКД",Повна зайнятість. Досвід роботи від 2 років. Незакінчена вища освіта.,1,
Middle Back-end developer,IT;,10–50 співробітників,", Користувач ОС Linux, PHP, MySQL, Git, Організованість, Laravel, Docker, Redis, Програмування, Symfony, Проактивність",Повна зайнятість. Досвід роботи від 2 років.,1,
Інженер-програміст баз даних (SQL),Харчова промисловість;,більше 1000 співробітників,", MS Excel, SQL, Користувач 1С, C#, VBA, Програмування, MS SQL Server, MS Access, SSAS",Повна зайнятість. Досвід роботи від 1 року. Вища освіта.,1,
Програміст 1C,"Пошук персоналу, HR;",менше 10 співробітників,", Користувач 1С, XML, Користувач ERP-системи, Користувач BAS, Програмування, Висока працездатність, Програмування BAS, Налаштування СКД","Повна зайнятість. Також готові взяти людину з інвалідністю, ветерана. Досвід роботи від 2 років.",1,
Strong Junior Java Full Stack Developer,"Фінанси, банки, страхування;",250–1000 співробітників,", Java, SQL, Користувач ОС Windows, Git, Python, PostgreSQL, Комунікабельність, Відповідальність, Знання принципів ООП, Apache Tomcat, Apache Maven, Hibernate, Spring Boot, Пунктуальність, JavaFX, Уважність, Jenkins, JPA, Java Message Service, Hudson, Самостійність, Бажання вчитися і розвиватися, CI/CD",Повна зайнятість. Досвід роботи від 2 років. Вища освіта.,1,Англійська — середній
PHP Fullstack Developer (PrestaShop),IT;,10–50 співробітників,", CSS, JavaScript, HTML, PHP, MySQL, Відповідальність","Повна зайнятість, неповна зайнятість. Також готові взяти студента. Досвід роботи від 1 року.",1,"Англійська — середній, українська — вільно"
Програміст 1C у Київ,"Сільське господарство, агробізнес;",250–1000 співробітників,", Користувач 1С, Ведення бухгалтерського обліку, Користувач BAS, Цілеспрямованість, Програмування, Програмування 1С, Надійність",Повна зайнятість. Досвід роботи від 5 років.,1,
Програміст 1С,"Оптова торгівля, дистрибуція, імпорт, експорт;",250–1000 співробітників,", Користувач 1С, Ведення бухгалтерського обліку, Користувач ERP-системи, Користувач BAS, Програмування, Програмування 1С",Повна зайнятість. Досвід роботи від 1 року.,1,
Senior Front-End Developer,,,", Bootstrap, Angular, Angular Material, Frontend-розробка, Swagger, Tailwind CSS, StompJs, Google Maps",Повна зайнятість. Досвід роботи від 5 років. Вища освіта.,1,
C++/Qt Widgets developer,IT;,50–250 співробітників,", MySQL, SQL, C++, Qt, GUI",Повна зайнятість. Досвід роботи від 5 років.,1,
"Senior Full-Stack Developer (Laravel, JS)",IT;,10–50 співробітників,", CSS, Користувач ОС Linux, HTML, PHP, MySQL, Git, Content Management System, Laravel, Docker, Верстка, Frontend-розробка, Розробка API",Повна зайнятість. Досвід роботи від 2 років.,1,
"Full stack програміст, Technical Product Manager",Роздрібна торгівля;,10–50 співробітників,", Управління проєктами, ТЗ, розробка, mage, odo","Повна зайнятість, неповна зайнятість. Досвід роботи від 2 років. Вища освіта.",1,
Strong Junior Database Developer,"Фінанси, банки, страхування;",250–1000 співробітників,", Java, SQL, Користувач ОС Windows, Python, PostgreSQL, XML, Комунікабельність, Відповідальність, Пунктуальність, Уважність, Самостійність, Бажання вчитися і розвиватися",Повна зайнятість. Досвід роботи від 1 року. Вища освіта.,1,Англійська — середній
SQL developer,"Фінанси, банки, страхування;",50–250 співробітників,", SQL, MS SQL Server, Oracle SQL Developer",Повна зайнятість. Досвід роботи від 2 років. Вища освіта.,1,Українська — вільно
Front-end React developer (Middle),IT;,50–250 співробітників,", CSS, Figma, HTML, Git, Gulp, React, JSON, Комунікабельність, webpack, Node.js, REST API, Верстка, Адаптивна верстка, Express.js, Frontend-розробка, Vite.js, Оптимізація коду",Повна зайнятість. Досвід роботи від 2 років.,1,
"Str. Junior Full-Stack Developer (JS, С#)",IT;,50–250 співробітників,", CSS, HTML, SQL, JavaScript, C#, jQuery, MS SQL Server, Vue.js, REST API, REST, Програмування, GraphQL, Розробка API",Повна зайнятість. Досвід роботи від 1 року. Вища освіта.,1,
Програміст бази даних,Харчова промисловість;,50–250 співробітників,", MS Excel, SQL, VBA, Програмування, Доброзичливість",Повна зайнятість. Досвід роботи від 2 років. Вища освіта.,1,
"Strong Middle Full Stack Developer (Laravel, Vue.js)",IT;,менше 10 співробітників,", PHP, SQL, JavaScript, Trello, Організованість, Laravel, Vue.js, REST API, NoSQL, Бажання вчитися і розвиватися",Повна зайнятість. Досвід роботи від 2 років.,1,
Програміст 1С,Роздрібна торгівля;,10–50 співробітників,", Користувач 1С, Користувач BAS, Програмування, Програмування 1С",Повна зайнятість. Досвід роботи від 2 років.,1,
Rust Developer (Blockchain),IT;,10–50 співробітників,,Повна зайнятість. Досвід роботи від 2 років. Вища освіта.,1,
"Спеціаліст підтримки, Support Software Engineer (L2)",IT;,50–250 співробітників,", Ведення CRM, Здатність до навчання, Програмування, Грамотна усна та письмова мова, Друга лінія підтримки",Повна зайнятість. Досвід роботи від 1 року.,1,
Програміст 1C/BAS,"Медицина, охорона здоров'я, аптеки;",50–250 співробітників,", Користувач 1С, Ведення бухгалтерського обліку, Відповідальність, Користувач ERP-системи, Користувач BAS, Програмування, Програмування BAS",Повна зайнятість. Досвід роботи від 2 років. Вища освіта.,1,
Програміст 1C,Роздрібна торгівля;,більше 1000 співробітників,", SQL",Повна зайнятість. Досвід роботи від 1 року.,1,
"Strong Junior, Middle iOS Developer",IT;,менше 10 співробітників,", CSS, HTML, Git, GitHub, Firebase, Xcode, UIKit, Objective-C, UI-дизайн, GCD, Alamofire, iOS-розробка, OneSignal, URLSession, Swift programming language","Повна зайнятість, неповна зайнятість. Також готові взяти студента, людину з інвалідністю, ветерана. Досвід роботи від 1 року.",1,Англійська — середній
Junior WordPress Developer,IT;,10–50 співробітників,", JavaScript, Відповідальність, Здатність до навчання, Самостійність",Повна зайнятість. Досвід роботи від 1 року.,1,Англійська — середній
"PHP developer (trainee, intern)",IT;,10–50 співробітників,", PHP, Bootstrap, jQuery, Laravel, Адміністрування Apache, nginx, Yii, Уважність, LAMP","Повна зайнятість. Також готові взяти студента, людину з інвалідністю.",1,
"Back-end програміст (Node.JS, Middle)",IT;,50–250 співробітників,", MySQL, PostgreSQL, Node.js, MS SQL Server, Sequelize, ORM, Express.js",Повна зайнятість. Досвід роботи від 2 років. Вища освіта.,1,
Full Stack Developer,"Неприбуткові, благодійні та громадські організації;",50–250 співробітників,", CSS, HTML, PHP, WordPress, Git, JavaScript, Vue.js, AWS, Бажання вчитися і розвиватися",Повна зайнятість. Також готові взяти ветерана. Досвід роботи від 2 років. Вища освіта.,1,Українська — вільно
Оператор-програміст ЧПК,Гірнича промисловість;,50–250 співробітників,", SolidWorks, Відповідальність, Знання САПР, Розробка креслень, Робота на верстатах ЧПК, CAD/CAM",Повна зайнятість. Досвід роботи від 2 років.,1,
Unity developer,IT;,250–1000 співробітників,,Повна зайнятість. Досвід роботи від 1 року.,3,
Програміст 1C у Івано-Франківськ,Роздрібна торгівля;,менше 10 співробітників,", SQL, Користувач 1С, Програмування, Робота з базою даних, Програмування 1С",Повна зайнятість. Досвід роботи від 2 років.,1,
Програміст Bitrix,Легка промисловість;,50–250 співробітників,", PHP, Комунікабельність, Відповідальність, Бажання вчитися і розвиватися, User Bitrix24, 1С-Битрикс, знання PHP, JavaScript, HTML, CSS, Bitrix API",Повна зайнятість. Досвід роботи від 2 років.,1,
Розробник 1C,Роздрібна торгівля;,більше 1000 співробітників,", Користувач 1С, Користувач ERP-системи, Користувач BAS, Адміністрування 1С, 1С УТП, Налаштування СКД",Повна зайнятість. Досвід роботи від 2 років. Вища освіта.,1,
Програміст 1С,"Краса, фітнес, спорт;",250–1000 співробітників,", Програмування, Програмування 1С",Повна зайнятість. Досвід роботи від 2 років.,1,
SQL-розробник,Роздрібна торгівля;,250–1000 співробітників,", SQL, MS SQL Server, Адміністрування СУБД, SSRS, SSIS, Продуктивність",Повна зайнятість. Досвід роботи від 2 років.,1,
"Junior Android, iOS Developer",IT;,10–50 співробітників,", Здатність до навчання",Повна зайнятість. Також готові взяти студента.,1,
Програміст 1C,Роздрібна торгівля;,більше 1000 співробітників,", Користувач 1С, Ведення бухгалтерського обліку, XML, JSON, Цілеспрямованість, Робота з базою даних, Бажання вчитися і розвиватися, CSV",Повна зайнятість. Досвід роботи від 1 року.,1,
Программист 1С,"Медицина, охорона здоров'я, аптеки;",250–1000 співробітників,", Пользователь 1С, Ведение бухгалтерского учета, Пользователь ERP-системы, Пользователь BAS, Программирование, Работа с базой данных","Повна зайнятість, неповна зайнятість. Також готові взяти людину з інвалідністю. Досвід роботи від 1 року. Вища освіта.",1,
Front-end програміст,IT;,10–50 співробітників,", CSS, Java, React, React Router, webpack, TypeScript, Креативність, Frontend-розробка, Адаптивність, Управління командою, Tailwind CSS, Styled-components, React testing library",Повна зайнятість. Досвід роботи від 2 років. Вища освіта.,1,Англійська — просунутий
Програміст Oracle apex (залізничні перевезення),"Транспорт, логістика;",250–1000 співробітників,", HTML, SQL, Користувач ОС Windows, Oracle Database, Oracle SQL Developer, PL/SQL, Програмування, Oracle APEX","Повна зайнятість. Також готові взяти людину з інвалідністю, ветерана, пенсіонера. Досвід роботи від 2 років.",1,
"Програміст (Middle/Senior, PHP)",IT;,10–50 співробітників,,Повна зайнятість. Також готові взяти студента. Досвід роботи від 1 року.,1,
Програміст 1С,Роздрібна торгівля;,більше 1000 співробітників,", MS Excel, MySQL, Користувач 1С, Програмування, Програмування 1С, Налаштування СКД",Повна зайнятість. Досвід роботи від 1 року.,1,
Senior iOS Developer,"Консалтинг, бухгалтерія, аудит;",250–1000 співробітників,", PHP, MySQL, Firebase, MVVM, UIKit, UI-дизайн",Повна зайнятість. Досвід роботи від 2 років.,1,
Програміст 1C,"Транспорт, логістика;",більше 1000 співробітників,", SQL, Користувач 1С, Ведення бухгалтерського обліку, Відповідальність, MS SQL Server, Програмування, Старанність, Ініціативність, Налаштування СКД",Повна зайнятість. Досвід роботи від 2 років.,2,
Інженер-програміст,"Сільське господарство, агробізнес;",більше 1000 співробітників,", MS Word, MS Excel, Користувач ОС Linux, Користувач ПК, C++, MS Visual Studio, AutoCAD, Цілеспрямованість, Програмування",Повна зайнятість. Досвід роботи від 5 років. Вища освіта.,1,
Програміст 1C,"Оптова торгівля, дистрибуція, імпорт, експорт;",50–250 співробітників,", SQL, Користувач 1С, Користувач BAS, Робота з базою даних, Програмування 1С, Програмування BAS",Повна зайнятість. Досвід роботи від 2 років.,1,
"Full Stack developer (Node.JS, React/Vue)",IT;,10–50 співробітників,", JavaScript, React, Node.js, Vue.js",Повна зайнятість. Досвід роботи від 1 року.,1,
Embedded-розробник,IT;,менше 10 співробітників,", Python, Дизайн, Altium Designer, SPI, Знання архітектури ARM, STM32, ESP32","Повна зайнятість. Також готові взяти студента, людину з інвалідністю, ветерана. Досвід роботи від 2 років. Вища освіта.",1,
"Trainee PHP/JS developer (учень, студент)",IT;,менше 10 співробітників,", Програмування, Бажання вчитися і розвиватися, Аналітичне мислення, Наполегливість, Ініціативність",Повна зайнятість. Також готові взяти студента.,1,
C/C++ Embedded developer (STM32),Сили оборони,,", C++, Комунікабельність, Стресостійкість, Програмування",Повна зайнятість. Досвід роботи від 1 року.,1,
Програміст Opencart,"Оптова торгівля, дистрибуція, імпорт, експорт;",50–250 співробітників,", MySQL, OpenCart",Повна зайнятість. Досвід роботи від 1 року.,1,Українська — вільно
Програміст 1C,Роздрібна торгівля;,більше 1000 співробітників,", Користувач 1С, Ведення бухгалтерського обліку, XML, JSON, Цілеспрямованість, Робота з базою даних, Бажання вчитися і розвиватися, CSV",Повна зайнятість. Досвід роботи від 1 року.,1,
Інженер технолог-програміст ЧПК,Машинобудування;,10–50 співробітників,,Повна зайнятість. Досвід роботи від 5 років.,1,
